,post_url,num_likes,num_comments,caption
102,https://scontent-sea1-1.cdninstagram.com/vp/7a98ecfdd4f223e5cb17ca08ae8045fe/5E573E03/t51.2885-15/e35/s1080x1080/69649626_770409030065170_4270306127055013835_n.jpg?_nc_ht=scontent-sea1-1.cdninstagram.com&_nc_cat=110,162961,840,"Photo by Luca Locatelli @LucaLocatelliPhoto // Sponsored by @thenorthface // I am currently working on a story for National Geographic magazine about sustainable innovations. I am investigating the fast fashion industry and possible solutions to reverse the damage generated by textile waste. This image is from inside one of the biggest textile recycling facilities in the Netherlands. More than a hundred people separate the textiles and grade them to ensure every piece becomes reusable. Textile waste has a huge impact on our planet. The cotton industry produces 10 percent of global carbon emissions worldwide, and uses about 5 percent of all pesticides and 14 percent of insecticides sold globally. The fast fashion industry needs a new way to create circularity around textile waste and reduce the impact in the coming years. Millennials are the biggest clients in this sector, demanding sustainable, durable, and Earth-friendly products instead of status symbols. Market demands and recycling technologies could be the right combination to push the fast fashion industry to create more sustainable products and reduce the impact on our planet. // The North Face and @rei have teamed up to create the #RewindNature series. In a new episode, sustainability advocate Kaméa Chayne explores fast fashion’s environmental and psychological effects."
103,https://scontent-sea1-1.cdninstagram.com/vp/edd5e6d39ad536eb1c3b2df01baa8d37/5E56BE87/t51.2885-15/fr/e15/p1080x1080/69092213_128141211877512_85017918822636283_n.jpg?_nc_ht=scontent-sea1-1.cdninstagram.com&_nc_cat=100,707660,2596,"Photo by George Steinmetz @geosteinmetz | Chinstrap penguins leave a pink trail of poo as they return to their nests on high ground at Deception Island, Antarctica. Males and females take turns incubating their chicks and make a daily commute down to the sea for feeding. A recent census of chinstraps here showed approximately 52,000 nests, down from 85,000 in 2003, due to loss of their principal food, krill, which feed on marine algae on the underside of sea ice. Krill populations are declining with increasing water temperatures and commercial krill fishing for animal feed. #climatechangeisreal #marchofthepenguins  To explore more of our world from above, follow @geosteinmetz."
104,https://scontent-sea1-1.cdninstagram.com/vp/1a1084ff45498f6a3ea7cd7c8ee6e675/5E4ABCC1/t51.2885-15/fr/e15/p1080x1080/67762463_497712437682612_7605031253569686330_n.jpg?_nc_ht=scontent-sea1-1.cdninstagram.com&_nc_cat=100,176834,1085,"Photo by Robin Hammond @hammond_Robin | “When I was 16, my mother, in true fashion of the 1950s, declared to me that if any of her children was queer, she would kill them.” I met Bob Frew, now 76, at his home in Orlando. He continued: “Since I had already experimented and enjoyed teenage sexual excursions with other boys, I knew that she was talking to me, and that was enough to put me in the closet.” That’s where he stayed for the next 30 years; he was 46 when he first went to a gay bar. Like many LGBTQ+ people around the world, Bob had to deal with bigotry, though he says: “the only discrimination that I experienced in my life about being gay came from the people that were supposed to love me the most, my mother and my
church.” Bob was widowed in January this year when he lost his partner of 30 years. Bob’s story was recorded as part of ""Stonewall at 50: Stories of resilience and resistance."" It can be seen on the Nat Geo site. For more from the series follow @whereloveisillegal"
105,https://scontent-sea1-1.cdninstagram.com/vp/2562cc73c9c09b6903a359b5ffb7debc/5E45273E/t51.2885-15/fr/e15/s1080x1080/71298476_176624736824605_7247969799805583876_n.jpg?_nc_ht=scontent-sea1-1.cdninstagram.com&_nc_cat=101,345767,996,"Photo by William Albert Allard @williamalbertallard | Cow Horse in the Snow, Padlock Ranch, Montana, 1978

This is a favorite horse portrait, made during calving season in Montana. The horse was used by ranch hands watching over first-calf heifers in a nearby pasture. When a heifer seemed ready to give birth, a cowboy would drive her into a fenced area; when the calf dropped, he’d bring it into the calving barn with a sled, tied by rope to the cowboy’s saddle. This horse was left waiting to be used, standing outside the shed where the cowboys would warm themselves and drink endless cups of coffee. For more images of the American West and other assignments spanning a five-decade career #followme @williamalbertallard. @thephotosociety #montana #ranch #horse #snow"
106,https://scontent-sea1-1.cdninstagram.com/vp/fa0178b129fd1df71ecdd0ef3da84a65/5E4CB796/t51.2885-15/fr/e15/s1080x1080/72555525_172367233916223_8866522403641419630_n.jpg?_nc_ht=scontent-sea1-1.cdninstagram.com&_nc_cat=103,392697,1170,"Photo by Michael Yamashita @yamashitaphoto | I'm mesmerized by the emerald waters of high-altitude Tibetan lakes, like this nameless one on route G317 to Lhasa. They're so striking in contrast to the surrounding monochromatic grasslands. These lakes, often made of saltwater, have a mineral content that gives them a green glow. People believe the lakes have spirits and therefore are worshiped by kora, a pilgrimage or circumambulation. The water is not used for anything, no fishing, bathing, boating, or washing—just looked at and admired. And thanks to the lone nomad who happened to be walking by to complete the picture. I wonder where she could be walking in the middle of nowhere. She has a long way to go. #tibet #tibetancolors #tibetanlakes #nomad"
107,https://scontent-sea1-1.cdninstagram.com/vp/b7c7fe942dc017d0578dd1625660612a/5E69493D/t51.2885-15/fr/e15/s1080x1080/69449067_103236107711092_7449788766312443153_n.jpg?_nc_ht=scontent-sea1-1.cdninstagram.com&_nc_cat=104,229016,544,"Photo by Robbie Shone @shonephoto | In 2015 I took part in the first @greenland_caves expedition to northeast Greenland. That original expedition was full of adventure: We flew as far as we could in a Twin Otter to a tiny landing strip on a sandy spit of land in the middle of nowhere. We inflated a boat to cross a 20-kilometer-wide lake, and then hiked for three days to get to some small, seemingly insignificant caves near the top of the world. At the time, we didn’t know it would become a ""recce"" expedition that would lead to more research. Project leader Gina Moseley collected samples of cave calcite to reconstruct records of past climate change. The data proved important, resulting in a prestigious Austrian FWF Start prize, which enables the research to continue for another six years. On July 3, 2019, nine people set off on an interdisciplinary expedition back to 80’N."
108,https://scontent-sea1-1.cdninstagram.com/vp/be899855162d68717e0d11c944eb1b48/5E8B74C2/t51.2885-15/fr/e15/s1080x1080/69236486_896791464028784_3797249005186280514_n.jpg?_nc_ht=scontent-sea1-1.cdninstagram.com&_nc_cat=108,368459,848,"Photo by Ami Vitale @amivitale | After years of civil war in Mozambique, lions were all but lost in the Zambezi Delta region. In 2018, conservationists, landowners, donors, and the Mozambican government came up with an ambitious plan to add some two million acres to African lions’ range. They identified 24 healthy lions from reserves in South Africa and relocated them to central Mozambique to the Marromeu Game Reserve. In order to keep the genetic mix as wide as possible, the team sourced the lions from various reserves in South Africa and kept them all in a boma in KwaZulu Natal’s Mkhuze Game Reserve for three weeks to complete medical tests. Then they were sedated and put in two private planes for the journey to Mozambique.  Already, 20 cubs have been born since the lions’ release and it is estimated that that the population could grow to as many as 500 within 15 years. I covered this historic undertaking for my recent @natgeo story. Learn more by following @amivitale and reading ""How the world’s largest lion relocation was pulled off.""
@natgeoimagecollection @thephotosociety #lions #mozambique #worthmorealive"
109,https://scontent-sea1-1.cdninstagram.com/vp/3b517ba8992b933338988b945aa1c7d3/5E65D386/t51.2885-15/fr/e15/s1080x1080/73401875_474129099857690_112986772507413418_n.jpg?_nc_ht=scontent-sea1-1.cdninstagram.com&_nc_cat=102,231477,447,"Photo by Sara Hylton @sarahyltonphoto | Boats gather along the Meghna River in Chandpur, Bangladesh, one of the three major tributaries of the Ganges Delta. I made this photograph during National Geographic's female-led Sea to Source expedition, in which researchers traveled from the Bay of Bengal up to the Himalaya, in order to better understand how plastic moves through waterways and eventually into our oceans. For more stories follow me @sarahyltonphoto #expeditionplastic #Bangladesh #oceanplastic"
110,https://scontent-sea1-1.cdninstagram.com/vp/d66a6b4ada897bdfdab8f984b3181f9e/5E6A3416/t51.2885-15/e35/p1080x1080/71136598_413140026245614_3472940094358165576_n.jpg?_nc_ht=scontent-sea1-1.cdninstagram.com&_nc_cat=110,559284,1497,"Photo by George Steinmetz @geosteinmetz | Purse seiners wait for the opening of Chimbote Harbor, Peru. The Peruvian anchoveta is the world’s largest fishery by tonnage; the fish is primarily harvested for fishmeal and oil, critical components of feed for aquaculture, pig, and chicken farms throughout the world. To view more of our world from above, follow @geosteinmetz."
111,https://scontent-sea1-1.cdninstagram.com/vp/f59cb3fb710b81c29590acca55ac4f6c/5E5F99CD/t51.2885-15/e35/s1080x1080/74426890_2575748949319839_7171097257737281012_n.jpg?_nc_ht=scontent-sea1-1.cdninstagram.com&_nc_cat=103,377491,1398,"Photos by Richard Barnes @richardbarnes | Can the remarkable architecture built by monstrous leaders redeem their reputations? Nero, emperor of ancient Rome, was known for killing two of his wives, allegedly killing his mother, crucifying Christians, and ordering the stoic philosopher Seneca to commit suicide. Nero was emperor when Rome burned in 64 C.E. His legacy lives on in the ambitious architectures he built, such as the Colosseum and his palace, the Domus Aurea (Golden House). It is thought that Villa Oplontis was owned by Nero and used as his second wife’s residence; its colorful frescoes have been remarkably preserved. Some say he was an avant-garde artist and visionary, his brutality simply a product of his time. Other historians define him by his obsession with popularity, and his desire for a godlike authority. Known as a public relations master, he embraced spectacle and performance on a grand scale. Follow @richardbarnes for more. #richardbarnes #nero #rome #emperors"
112,https://scontent-sea1-1.cdninstagram.com/vp/a49209d2449816ef70085c4046fa82e2/5E4D8FD7/t51.2885-15/fr/e15/s1080x1080/69216733_408461939865154_1958735107520538083_n.jpg?_nc_ht=scontent-sea1-1.cdninstagram.com&_nc_cat=110,382252,1097,"Photo by Cristina Mittermeier @mitty | It's World Animal Day! A brown pelican at rest, wrapped in a cocoon of feathers the color of chocolate. Meeting this pelican on a recent expedition to the Galápagos, I wanted to capture the texture of its plumage, which to me looks like one of those fancy cloaks the ancient Inca priests used to wear. This bird in particular has an air of wisdom about it, as if it might unfurl its wings and divulge secrets from an age long past, or perhaps our present. Today birds all over the world have been discovered dead,  their bellies bloated and full of plastic. Some parents have even been photographed feeding their young bits of plastic including plastic caps, lighters, and cigarette butts. Seabirds depend on a healthy ocean as much as the fish that they eat. Follow me @mitty to learn how you can have an impact and live a more sustainable lifestyle by taking the @NatGeo plastic pledge. #galapagos #conservation #planetorplastic #hydratelike #WorldAnimalDay"
113,https://scontent-sea1-1.cdninstagram.com/vp/afcac22f9fa381e88eeb7c5d58efd919/5E6990DC/t51.2885-15/fr/e15/p1080x1080/70964710_655654051509401_3610259725134398207_n.jpg?_nc_ht=scontent-sea1-1.cdninstagram.com&_nc_cat=105,508194,1087,Photo by Renan Ozturk @renan_ozturk | The king of the sea ice is on the hunt in the twilight of the midnight sun in northern Svalbard.  Join me @renan_ozturk for more current photography from the Arctic.
114,https://scontent-sea1-1.cdninstagram.com/vp/867f1ab144412bfb70b2439a331fa9b5/5E5B7AA6/t51.2885-15/fr/e15/s1080x1080/71510681_931870750517093_3659900704709949206_n.jpg?_nc_ht=scontent-sea1-1.cdninstagram.com&_nc_cat=105,280959,1426,"Photo by Kitra Cahana @kitracahana | The Anderson Trojan cheerleading team prepares for their performance at the night's varsity football game. 2010. #archive #texas #austin #cheerleading #football

Nat Geo is celebrating women who fearlessly push boundaries and inspire the next generation of changemakers. For a week, all of our posts and stories on @natgeo were photographed by women, about women. Use #NatGeoWomenofImpact to share how a woman in your life has empowered you."
115,https://scontent-sea1-1.cdninstagram.com/vp/7e1db1fe5a7e5b9557f0ee9582f864be/5E454015/t51.2885-15/fr/e15/s1080x1080/73480793_426109544764072_1466664320540207617_n.jpg?_nc_ht=scontent-sea1-1.cdninstagram.com&_nc_cat=104,248657,1243,"Photo by Jodi Cobb @jodicobbphoto | As the first and only woman staff field photographer at National Geographic, I was inevitably defined as a “woman photographer,” as if gender alone would explain my motivations, vision, and desires. I fought that label; it seemed like an extra job to do. I felt a burden to be perfect, capable of doing all the things the men could do. 
But I eventually realized that being a woman was the best thing about my life. I was welcomed into the hidden worlds of women that had never been photographed before, especially those at the edge of change, facing cultural dislocation from war, poverty, and human trafficking. I’ve explored the complexities of their lives, searching for the moments that reveal how they prevail or just survive. I’ve found women defiant, triumphant, or simply making the best of it. But the women who’ve inspired and humbled me the most are those enduring the most brutal circumstances and somehow surviving, against all odds. Here, women in debt bondage in India work in the brick kilns, bearing astonishing burdens all day, every day. Follow me @jodicobbphoto for more images of women and the world. #humantrafficking"
116,https://scontent-sea1-1.cdninstagram.com/vp/a19f73ad123dcce4e5c5cc6937288dcf/5E6917F3/t51.2885-15/fr/e15/s1080x1080/71292656_422907141703722_4129288192099848465_n.jpg?_nc_ht=scontent-sea1-1.cdninstagram.com&_nc_cat=106,202666,464,"Photo by Karla Gachet @kchete77 | Adela Choquetiglla and daughter Maribel Chambi comb their hair at home in Colchani, Bolivia. They are Aymara, one of the indigenous cultures in the Andes. The town is near the Salar de Uyuni, the world's largest salt flats, where most of the salt in Bolivia originates. According to Aymaran tradition, the mountains used to be giants that walked the Earth; Tunupa, Kusku, and Kusina were mountains surrounding the Salar. Tunupa married Kusku, who ran away with Kusina. Tunupa cried while breastfeeding her son, and her tears mixed with her milk, forming the Salar. Some Aymarans consider Tunupa a deity and say that the place should be called Salar de Tunupa. #andesmagic #aymaraculture"
117,https://scontent-sea1-1.cdninstagram.com/vp/11d2f15c820abd2b5f70a32cbbdfc131/5E676A3F/t51.2885-15/fr/e15/p1080x1080/70493334_393091811612732_7951486112940725853_n.jpg?_nc_ht=scontent-sea1-1.cdninstagram.com&_nc_cat=108,1487029,5945,"Photo by Steve Winter @stevewinterphoto | Check out the September issue of @natgeo magazine for the story behind this image. 
She seems to be asking, what are you doing to my home?
A wise man once said, “Where there is life there is hope, but the time to act is now.” We are in danger of losing more than one million species to extinction. And we will suffer greatly,  as we are part of nature and everything on the planet is connected. Nature is perfection.
All of us, and especially young people, need to take back the planet from the ones who care only about the short term. Fifty-plus percent of the biodiversity is found in forests, and each tree produces enough oxygen for 12 people. We all need to work toward a future where we protect 50% of our planet–so we have a future for generations to come. Take a walk in the woods and hear the symphony of nature in the birds and insects or walk on the beach. Nature heals. I have hope; without it, what is left? Believe."
118,https://scontent-sea1-1.cdninstagram.com/vp/f5c0bb0199bb4bf2e355a498659378a4/5E4BFDCE/t51.2885-15/fr/e15/s1080x1080/72270705_494598061121689_8447410924591529119_n.jpg?_nc_ht=scontent-sea1-1.cdninstagram.com&_nc_cat=101,322161,921,"Photo by Beverly Joubert @beverlyjoubert | Resting the heavy weight of his trunk on a tusk. Tusks are such useful things—if you happen to be an elephant! Unfortunately for elephants, people have developed a penchant for these teeth and it has led to the killing of up to 30,000 elephants a year. Make no mistake, ivory is a symbol of death—not only of the elephants that have been killed but also of the many rangers who have died protecting these highly intelligent and social animals from poachers in the illegal pursuit of this commodity. #thisismytrophy #saynotoivory #whenthebuyingstopsthekillingcantoo"
119,https://scontent-sea1-1.cdninstagram.com/vp/b7c71a7f87b88b387b4e49a41c439f7d/5E47DFBD/t51.2885-15/e35/s1080x1080/70600742_965066083835908_6006937605666968828_n.jpg?_nc_ht=scontent-sea1-1.cdninstagram.com&_nc_cat=104,423675,4827,"Photo by @brianskerry // Sponsored by @AmericanExpress // An olive ridley sea turtle finds itself entangled in a plastic basket in the waters off Sri Lanka. In the four decades that I’ve been exploring the world’s oceans, I have seen more plastic in the sea each year. The devastating impact this has on marine wildlife is substantial and can be seen in many ways. In this case, the turtle likely came close to the drifting basket because floating objects in the ocean often attract marine life below. The basket had a plastic rope handle and the turtle’s flippers became severely entangled, preventing the turtle from swimming or diving. After making this photograph, I was able to free the turtle, and it swam away quickly. // Go to @AmericanExpress to learn more about what American Express is doing to address marine plastic pollution and to discover how you can get involved."
120,https://scontent-sea1-1.cdninstagram.com/vp/974dde0f6a5fe89ea23beafc5c5fae53/5E88A4D2/t51.2885-15/fr/e15/s1080x1080/69463738_538884190189458_4055275519314666197_n.jpg?_nc_ht=scontent-sea1-1.cdninstagram.com&_nc_cat=106,198328,521,"Photo by Ismail Ferdous @ismailferdous | August 16, 2017: Construction workers make polders to protect the shore of Cox's Bazar, Bangladesh. Each year in the monsoon season, Bangladesh faces heavy flooding, more than any other country in the world. It's one of the frontline victims of climate change. In recent years, riverbank erosion has annually displaced between 50,000 and 200,000 people. Follow @ismailferdous for more photos and stories around the world."
121,https://scontent-sea1-1.cdninstagram.com/vp/ca8dd41cc7ec78558c1fe763e2052e5e/5E5B6803/t51.2885-15/e15/69439024_384174145612126_6844947029030813343_n.jpg?_nc_ht=scontent-sea1-1.cdninstagram.com&_nc_cat=110,551142,1787,"Photo by Brian Skerry @brianskerry | A rare encounter with a pod of orcas in the Caribbean. I was working in the waters off Dominica, when at least eight orcas appeared and approached very close to me. Orcas are arguably the smartest animals in the sea, with rich cultures that include multiple dialects, feeding strategies, and parenting techniques. Each time I am with them is extraordinary. Follow @BrianSkerry for more images of whales, dolphins and other marine wildlife.  #orca #caribbean #dominica #whaleculture #planetofthewhales"
122,https://scontent-sea1-1.cdninstagram.com/vp/621d1723ac56b9f9d644cef950adb813/5E682065/t51.2885-15/e15/70598244_185140242511941_787623912095644571_n.jpg?_nc_ht=scontent-sea1-1.cdninstagram.com&_nc_cat=109,239945,1469,"Photo by Diana Markosian @markosian | Fifteen years ago a school in southern Russia became the site of a hostage situation that ended in 334 deaths—more than half were children. In this image, young graduates take part in the commemoration of Beslan, in which students release white balloons symbolizing all those who died in the attack. #beslan #russia #anniversary"
123,https://scontent-sea1-1.cdninstagram.com/vp/b8df07b20ea928985660238f5d84f313/5E496106/t51.2885-15/e35/s1080x1080/73713700_974791362874601_3567761153601842274_n.jpg?_nc_ht=scontent-sea1-1.cdninstagram.com&_nc_cat=105,174425,766,"Photos by John Stanmeyer @johnstanmeyer | Today is World Tsunami Awareness Day. After witnessing the enormity of what occurred on December 26, 2004, I was extremely affected. Having documented for decades the effects of war, conflict, and human indifference to why we can’t get along, there is always “someone to blame“ in these situations. With natural disasters that have occurred throughout Earth’s existence, when I asked those who survived how they felt or what could have been done, their universal response was “Who should I blame, God?” This reality deeply affected me, and I needed to understand how both the Earth, and humanity, heals. So began this multiyear, multidecade project of revisiting the exact spots where the earth had done its natural movements.

Upon returning one year later, the changes were profound, as seen here in the second photo. Returning four years later, I could barely find signs that a massive wall of water, more than 100 feet high, had ever existed. Thousands of new people had taken up residence, trees and plants had grown again in abundance. The landscape and those who now inhabited this area of Sumatra have changed.

Yes, the people to this day in Indonesia are still deeply affected by the enormity that took place on Boxing Day 2004, and the earth had healed beyond recognition, a reminder that the Earth doesn’t need us."
124,https://scontent-sea1-1.cdninstagram.com/vp/27917d0333ddb63410e67674d7046f2f/5E88BCE5/t51.2885-15/fr/e15/p1080x1080/74333551_2424571671091379_5345337150836418535_n.jpg?_nc_ht=scontent-sea1-1.cdninstagram.com&_nc_cat=111,181436,538,"Photo by Natalie Keyssar @nataliekeyssar | Two members of Moni Dance, a Caracas-based neighborhood dance team, hop a fence on a rooftop in the Catia area after performing at the opening of a new basketball court—part of a violence prevention initiative. Cultural programs like Moni Dance have become all the more important amid Venezuela's ongoing crisis, where grassroots arts collectives create a space for normalcy and empowerment."
125,https://scontent-sea1-1.cdninstagram.com/vp/b818dfa2b140137d189c04c9c92e66c5/5E8A9ED3/t51.2885-15/fr/e15/s1080x1080/68760948_2551634661559284_5751283003043735585_n.jpg?_nc_ht=scontent-sea1-1.cdninstagram.com&_nc_cat=100,212963,405,"Photo by Adam Dean @adamjdean | A villager harvests rice in Kwun Chan Kone village, Irrawaddy region, Myanmar,  November 2015."
126,https://scontent-sea1-1.cdninstagram.com/vp/d33b37f28b3c1330839be523e7e93665/5E594079/t51.2885-15/fr/e15/s1080x1080/71719358_131918664818624_7296290743340257475_n.jpg?_nc_ht=scontent-sea1-1.cdninstagram.com&_nc_cat=108,443575,1412,"Photo by David Guttenfelder @dguttenfelder, text by Craig Welch | Between the photo booths and the pretzel stands, not far from the electric violin player and the man who molds busts of tourists out of clay, sits the world's first solar-powered ferris wheel. The Santa Monica Pier is the place where America's Mother Road—Route 66—meets the Pacific, a fixture of the Los Angeles region, which is the cultural soul of our autocentric nation. But L.A. County, like the rest of the planet, is paying a price for our global dependence on fossil fuels. Following seven years of drought, visitors here last November could stare up into the hills and watch the menacing glow of the region's most destructive wildfire as it forced the evacuation of a quarter million people. Just 18 miles north, Malibu's Broad Beach is no longer so, as rising seas and storms bring this ever narrowing sandy reach right to back porches. Increasing heat threatens the health of many southern CA residents. So this seemed like the perfect place to start an epic journey, a road trip toward the unknown. We are crisscrossing the country in a series of electric cars, trying to examine our progress toward a cleaner energy future. Can we make this transition? Of course we can—if we truly make the effort. But what will it take, how are we doing, and how do we get there? Follow along as we attempt to find out. #roadtripto2070"
