,post_url,num_likes,num_comments,caption
345,https://scontent-sea1-1.cdninstagram.com/vp/814a8e5208c87f4e13227958ca8310f1/5E4D06CB/t51.2885-15/fr/e15/s1080x1080/72284229_1206225079565853_2654673635527326508_n.jpg?_nc_ht=scontent-sea1-1.cdninstagram.com&_nc_cat=109,201937,413,"Photo by Simon Norfolk @simonnorfolkstudio I Ascension Island is a small, isolated volcanic island in the middle of the South Atlantic, located 1,400 miles from the coast of South America and 1,000 miles from Africa. Much of the island is a wasteland of lava flows and cinder cones; forty-four distinct dormant craters have been identified. It is home to a British Royal Air Force station, a European Space Agency rocket tracking station, a US/UK signals intelligence facility, and a BBC relay station. In 2016, the United States Department of Energy started operating a mobile climate research facility on the island.
Here, the view takes in an ash and lava field and the cinder cone of Sister's Peak, on the edge of the Broken Tooth Live Firing Range. Follow me @simonnorfolkstudio for updates, outtakes, unpublished, and archive material.
#photojournalism #documentaryphotography #NationalPark #simonnorfolk #naturalworld"
346,https://scontent-sea1-1.cdninstagram.com/vp/35b75c204c2d98c2c738a8134b0e49fb/5E443EA2/t51.2885-15/fr/e15/s1080x1080/73512681_128156408176578_2553369686500212468_n.jpg?_nc_ht=scontent-sea1-1.cdninstagram.com&_nc_cat=106,278648,832,"Photo by Gabriele Galimberti @gabrielegalimbertiphoto and Juri De Luca | Fossils of long-extinct creatures aren’t just for museums. Today there’re in homes and businesses as wealthy collectors indulge a controversial hobby. A Kaatedocus siberi stands among an eclectic mix of wares at Theatrum Mundi, a private gallery in Arezzo, Italy. #dinosaur #fossil #extinct #dinosaurs"
347,https://scontent-sea1-1.cdninstagram.com/vp/d0cc0ea485011cd2eedaf2a4afe70a1e/5E5A08F2/t51.2885-15/fr/e15/s1080x1080/70713685_326418334870667_8687235335785406791_n.jpg?_nc_ht=scontent-sea1-1.cdninstagram.com&_nc_cat=111,269586,624,"Photo by Cristina Mittermeier @mitty | The Pantanal swamplands of Brazil are one of the most colorful, vibrant, and exciting ecosystems on the planet. Home to jaguars, macaws, and caimans, it is also where the fabled South American cowboys, or pantaneiros, have lived for generations. The cattle herds that roam the Pantanal are well adapted to the seasonally flooded landscape, and the marriage between wildlife and people is a beautiful thing to behold. Follow me @mitty for more images and stories from Brazil, one of my favorite places in the world. #Brazil #SouthAmerica #cowboys #horses #tradition"
348,https://scontent-sea1-1.cdninstagram.com/vp/22cc908cc072ba9ab91dc7488808ea81/5E5D563A/t51.2885-15/fr/e15/s1080x1080/71673359_482117655721208_453482263767904382_n.jpg?_nc_ht=scontent-sea1-1.cdninstagram.com&_nc_cat=108,224104,539,"Photo by Simon Roberts @simoncroberts | Namsan Park, on Mount Namsan, is the largest park in Seoul, South Korea. Each day, it draws thousands of people looking for a slice of nature in the middle of the city. During the rule of Taejo, the first king of the Joseon Dynasty, Namsan (south mountain) was considered a sacred shamanistic site. Today it offers wooded paths, cherry blossom trails, and some of the most spectacular views of downtown Seoul. #NamsanPark #UrbanParks #Seoul #MountNamsan"
349,https://scontent-sea1-1.cdninstagram.com/vp/7a86c8a9469e18919e198b4b616408e6/5E8C74C8/t51.2885-15/fr/e15/s1080x1080/69927278_133116468081120_1506398737081960390_n.jpg?_nc_ht=scontent-sea1-1.cdninstagram.com&_nc_cat=100,271697,780,"Photo by Jasper Doest @jasperdoest | Flamingo Bob visits the A.E. Goiloschool in Julianadorp, Curaçao. Bob is an animal ambassador for my cousin Odette's conservation charity @fdoccuracao. Odette, a veterinarian, rescued the bird after it flew against a hotel window on the island, and during the rehabilitation process she discovered it couldn't be released back to the wild due to a chronic foot condition (among other things). She decided to take care of the bird and make him an ambassador for her charity. Kids are excited to know about the natural world and what happens in it. Using their natural curiosity and love of animals is a great way to teach them about conservation. Just taking your kids around your neighborhood and talking about the trees and animals you see could be enough to show them how important the natural world is to our survival. With your help, they’ll become educated stewards of planet Earth. Follow @jasperdoest for more images of Flamingo Bob. #flamingobob #flamingo #natureeducation #conservationhero #curacao"
350,https://scontent-sea1-1.cdninstagram.com/vp/bc3a5ba0636442936b9c318d04d46750/5E55EF9B/t51.2885-15/fr/e15/s1080x1080/69804007_245471233097961_8082015527499853183_n.jpg?_nc_ht=scontent-sea1-1.cdninstagram.com&_nc_cat=109,465147,1866,"Photo by Steve Winter @stevewinterphoto | A polar bear comes toward our icebreaker ship, the M/V Kinfish, somewhere in Svalbard.
Over the past three decades, the oldest and thickest ice in the Arctic has declined by a stunning 95 percent, according to NOAA. The sea in the Arctic has changed dramatically, which impacts polar bears, walruses, and other Arctic creatures. If ice continues to melt, the planet will warm further, as the dark ocean water absorbs large amounts of solar heat that used to be deflected by the bright white ice. @stevewinterphoto @natgeo @natgeoimagecollection"
351,https://scontent-sea1-1.cdninstagram.com/vp/68659556d2a362428fdb5f65d4c7e956/5E46FCE8/t51.2885-15/e35/p1080x1080/70977617_1048483438830626_8916677907572226410_n.jpg?_nc_ht=scontent-sea1-1.cdninstagram.com&_nc_cat=102,412703,1222,"Photo by George Steinmetz @geosteinmetz | Harvesting wind and wheat on a farm near Hitchand, Texas. Wind power is now cheaper than fossil fuels in the U.S., but entrenched political interests are stopping construction of a power grid to get it to market. To see more of our world from above, follow @geosteinmetz. #windpower #renewableenergy #climatechangethefacts"
352,https://scontent-sea1-1.cdninstagram.com/vp/d4d6b534d0d656edbe2ca54f9e9e0ca8/5E572C5D/t51.2885-15/fr/e15/s1080x1080/69236488_523085055170750_614180385191312035_n.jpg?_nc_ht=scontent-sea1-1.cdninstagram.com&_nc_cat=102,387067,1043,"Photo by Stephen Alvarez @salvarezphoto | The rain-swept, single-track road to Iona winds across the Isle of Mull in western Scotland. Many of the single-lane roads in Scotland were established after the rebellions of the 1700s in an effort to stimulate the economy of remote areas and as a means of easing military access to them. Driving on these roads today can be a harrowing experience for the uninitiated, with traffic moving in both directions on a road designed for one-way travel. For more images from around the world follow me @salvarezphoto #scotland"
353,https://scontent-sea1-1.cdninstagram.com/vp/de70c9c8cd28ea33a8d2a5afd989ef44/5E4E7FDD/t51.2885-15/fr/e15/s1080x1080/67916406_165701807817990_7258004080436417119_n.jpg?_nc_ht=scontent-sea1-1.cdninstagram.com&_nc_cat=106,524093,1553,"Photo by Renan Ozturk @renan_ozturk |  A 26-photo drone stitch of Onekotan island, one of the masterpieces the Kuril chain. It's an active volcano rising out of the freshwater lake inside a caldera in the middle of the Sea of Ohkotsk. 
Most of these islands are currently uninhabited by humanity, yet true depths were revealed to us by marine mammal biologist Vladimir Burkanov, who has dedicated his life to studying the complex ecosystem of life here. Hoping the film we are working on can help him continue to understand and protect this place. 
Visit @renan_ozturk from more from this story."
354,https://scontent-sea1-1.cdninstagram.com/vp/247afb101a201d9712c0124bbf1b4fc3/5E51F336/t51.2885-15/fr/e15/p1080x1080/73301542_180252566358730_1607197446871059725_n.jpg?_nc_ht=scontent-sea1-1.cdninstagram.com&_nc_cat=110,159703,1146,"Photo by Erika Larsen @erikalarsen888 | Roxane Gay,  photographed in Los Angeles, August 21, 2018. Roxane Gay is a writer, professor, editor, and commentator. In anticipation of the 100th anniversary of the 19th amendment, National Geographic is highlighting what it means to be female. As part of that coverage, we photographed luminaries from around the world.

Check out the link in our bio to learn about Nat Geo’s groundbreaking new book that showcases an incredible group of history-making women. #NatGeoWomenofImpact"
355,https://scontent-sea1-1.cdninstagram.com/vp/68d59b6707e28e3a4049eff76ba70dfc/5E5E522A/t51.2885-15/fr/e15/s1080x1080/72404516_921260588258060_589648792248232222_n.jpg?_nc_ht=scontent-sea1-1.cdninstagram.com&_nc_cat=108,775786,4359,"Photo by Charlie Hamilton James @chamiltonjames | // Supported by Nat Geo Society/Wyss Campaign for Nature committed to protecting 30% of the planet by 2030. // A young Thomson's gazelle leaps across the plains of Kenya's Maasai Mara at sunset. The gazelle was grazing among a herd of zebra and topi when it decided to stretch its legs by running at high speed for a few minutes. Thomson's gazelles are one of the world's fastest land animals, able to hit speeds of 55 miles per hour. They need to be fast: they're a favorite prey of cheetahs. So running and leaping like this might perhaps be a valuable activity, designed to keep them fit and practicing weaving and dodging—which could save a tommie's life one day. #campaignfornature"
356,https://scontent-sea1-1.cdninstagram.com/vp/52fd86ead4121eb57b52d2d5462eb49d/5E44BD76/t51.2885-15/fr/e15/p1080x1080/69175755_172836160546838_6476834943270153141_n.jpg?_nc_ht=scontent-sea1-1.cdninstagram.com&_nc_cat=102,1024910,7311,"Photo by Cory Richards @coryrichards | Alex Honnold's groundbreaking free solo of El Capitan in Yosemite was a paradigm-shifting event, not just in climbing but in sport as a whole. Alex was already known throughout the climbing community as an outlier, but @freesolofilm (directed by @jimmychin and @chaivasarhelyi and produced by @natgeo) put him on display in an unprecedented way. In the film, to me, there was a necessary awkwardness and tension more palpable in the moments when Alex *wasn't* climbing, thus highlighting a seemingly tenuous relationship with ""normal"" life. And as otherworldly as the ultimate accomplishment seemed, the very reason it demanded such attention is because Alex, like all of us, is made up of flesh and bone. #followme to see more from my shoot with @alexhonnold for @espn #thebodyissue"
357,https://scontent-sea1-1.cdninstagram.com/vp/37ea2c0a51e40194a2009ebeddcf41f9/5E4911C2/t51.2885-15/fr/e15/s1080x1080/72392020_382797852607065_5827482328415613627_n.jpg?_nc_ht=scontent-sea1-1.cdninstagram.com&_nc_cat=109,349445,1650,"Photo by Joel Sartore @joelsartore | A black-footed ferret makes a rare stop in front of the camera during a photo shoot @thetorontozoo. This species came to the brink of extinction in the mid-1980s, when only 18 animals remained. Today captive breeding and reintroduction projects are helping the ferret population to recover—recent counts suggest there are approximately 300 individuals in the wild. To learn more about this adorable species, follow me @joelsartore. #blackfootedferret #ferret #endangeredspecies #PhotoArk"
358,https://scontent-sea1-1.cdninstagram.com/vp/53ee1bd67c7c054e8c1ceb0e097a7ad9/5E69B158/t51.2885-15/fr/e15/s1080x1080/75397744_145557253499363_3924923533169006548_n.jpg?_nc_ht=scontent-sea1-1.cdninstagram.com&_nc_cat=111,162322,403,"Photo by Ami Vitale @amivitale | Children sit inside Dariya Khan Ghhumnat Rahat camp, set up outside a school in the state of Gujarat in Ahmedabad, India in 2002. They were displaced after some of the worst communal riots in India's history broke out. For days, mobs rampaged the city, burning houses, looting shops, raping women, and killing men, women and children. 
While this crisis has passed, there are 40 million internally displaced persons around the world who, while remaining in their own county, have no specific legal status or special protections, and are often at risk of being caught in the cross fire or used as pawns, targets, and human shields. Women and girls are among the most vulnerable. You can help by following those that try to help those currently displaced, like @doctorswithoutborders @ICRC and @refugees
 @everydayrefugees @rippleeffectimages @thephotosociety #refugees #india #displaced #girls"
359,https://scontent-sea1-1.cdninstagram.com/vp/ca59c5b71e41ccfeb2cceeba1f1dc3a8/5E5E84EA/t51.2885-15/fr/e15/s1080x1080/75472278_137367530997588_1322608231882588769_n.jpg?_nc_ht=scontent-sea1-1.cdninstagram.com&_nc_cat=100,161715,755,"Photo by Dina Litovsky @dina_litovsky | Students at Kiev’s School 232 wait in anticipation of the last bell ceremony. It traces its origins to the Soviet Union era and is still observed in many post-Soviet cities. For many teenagers, this is the beginning of a new phase in their lives—a summer where choices about the future have to be made. But for the day, Kiev turns into a playground for students celebrating the last day of school. For more images, follow me @dina_litovsky."
360,https://scontent-sea1-1.cdninstagram.com/vp/392398ecc75557aa97748b7f1ece57d9/5E4905B3/t51.2885-15/e35/s1080x1080/68958214_1528934837273914_5386216091411424122_n.jpg?_nc_ht=scontent-sea1-1.cdninstagram.com&_nc_cat=110,467814,1039,"Photos by Paul Nicklen @paulnicklen | Some of my favorite assignments for National Geographic have taken place in Lancaster Sound. Not far from there is a new Canadian marine protected area, Tuvaijuittuq—""the place where the ice never melts"" in Inuktitut. This marks the beginning of a conservation economy in the north, creating new jobs and ensuring Inuit leadership in this region for generations to come. What an incredible announcement to celebrate! Follow me @PaulNicklen and explore my feed for more of this polar region."
361,https://scontent-sea1-1.cdninstagram.com/vp/9e7ac4067a5354d0a0624fe084a35d26/5E516F3F/t51.2885-15/fr/e15/s1080x1080/74665219_103646437691214_3958149844286229439_n.jpg?_nc_ht=scontent-sea1-1.cdninstagram.com&_nc_cat=106,236207,445,"Photo by Simon Norfolk @simonnorfolkstudio I This scene is on the tiny island of Hamnøy, connected by bridge to Moskenesøya, part of the Lofoten Islands in Arctic Norway. Stockfish is unsalted fish, especially cod, dried by cold air and wind on wooden racks called hjell. The drying of food is the world's oldest known preservation method, and dried fish has a storage life of several years. Due to the stable, cold conditions, the stockfish produced on the Lofoten Islands is regarded as the best. Stockfish is Norway's longest sustained export commodity, first mentioned in the Icelandic saga ""Egilssaga,"" when Chief Torolv Kveldulvssøn shipped stockfish from Helgeland in Norway to Britain in 875. This product represented most of Norway's national income from the Viking age through to the medieval period.
Many of the cod heads are bought by the Norwegian government and given away as Norway's food aid to areas of crisis in the developing world. Follow @simonnorfolkstudio for updates, outtakes, unpublished, and archive material. #norway #arctic #norgefoto #norgesfoto #Nordland"
362,https://scontent-sea1-1.cdninstagram.com/vp/1e080ea6c80653c1da9b1c133e6f5be8/5E454793/t51.2885-15/fr/e15/p1080x1080/74706193_443100086329271_2413873691702777382_n.jpg?_nc_ht=scontent-sea1-1.cdninstagram.com&_nc_cat=111,183043,708,"Photo by Rena Effendi @renaeffendiphoto | Sisters hold a plate of boiled chickpeas, one of the ingredients in bozbash, a traditional minced meat broth in Azerbaijan. I took this photograph in Khinaliq village, one of the highest populated points in Azerbaijan, where about 1,000 shepherd families live without many basic modern amenities, such as gas and running water. For more human interest stories #followme @renaeffendiphoto #women #power #beauty #azerbaijan

Nat Geo is celebrating women who fearlessly push boundaries and inspire the next generation of changemakers. For a week, all of our posts and stories on @natgeo were photographed by women, about women. Use #NatGeoWomenofImpact to share how a woman in your life has empowered you."
363,https://scontent-sea1-1.cdninstagram.com/vp/c9788da7fd4726c7ebfcdd6f54467813/5E4E9FAE/t51.2885-15/fr/e15/s1080x1080/73512759_417736435832700_544136978215684659_n.jpg?_nc_ht=scontent-sea1-1.cdninstagram.com&_nc_cat=1,257190,415,"Photo by @iantehphotography | When I took this image in 2007, I was struck by how this beautiful scene looked like a sunset over wintery trees at dusk. In fact, it was a chimney belching out flames from a nearby coal plant in Linfen, China. Back then, I was working on a series of images that explored the coal industry in China, which at the time was said to build an average of two coal power stations a week. Since then China has taken great strides to improve its environment. Today it invests more into alternative energy than any country in the world. However, a report published last year by the Global Environment Institute, a U.S.-based research group, found that the country is involved in building or planning over 100 coal-fired power plants across nations involved in its Belt and Road Initiative. #coal #globalwarming #fossilfuels"
364,https://scontent-sea1-1.cdninstagram.com/vp/f5a880f81357e8dc318cd6a98f21e56a/5E4A422F/t51.2885-15/fr/e15/s1080x1080/71533410_1334066626752741_1767710453983281898_n.jpg?_nc_ht=scontent-sea1-1.cdninstagram.com&_nc_cat=109,304212,2337,"Photo by Thomas Peschak @thomaspeschak | When rations run short on Wolf Island, in the remote northern Galápagos, the sharp-beaked ground finches become vampires. Their sitting targets are the Nazca boobies and other large birds nesting on the plateau. Boobies thrive here, nesting among dense cactus thickets and fishing in the surrounding ocean, but the finches have a tougher time. The island has no permanent water and little rainfall. The finches–birds that inspired Darwin’s Theory of Evolution–rely on a scant diet of seeds and insects that regularly dries up. Pecking away at the base of booby flight feathers with their sharp beaks–a trait that may have evolved from feeding on the birds’ parasites–they drink blood to survive. For more photographs of vampire birds follow @thomaspeschak."
365,https://scontent-sea1-1.cdninstagram.com/vp/39c313b87b795afdb76cb40b3d04df67/5E4A4772/t51.2885-15/fr/e15/s1080x1080/68893091_688960091583233_7167620460565230157_n.jpg?_nc_ht=scontent-sea1-1.cdninstagram.com&_nc_cat=105,314735,898,"Photo by Cristina Mittermeier @cristinamittermeier | Do you see inside of this whale's mouth the bristles that look like hair? Baleen whales like these humpbacks, which I photographed feeding off the coast of British Columbia, do not have teeth; they have baleen plates, a filter-feeding system that allows baleen whales to filter their food, usually small fish or krill, by swimming for their prey with their mouths wide open. Water passes through the baleen, but small prey like krill and herring and salmon are caught in the bristles, and then swallowed whole. Baleen whales have narrow throats and do not usually eat larger prey like squids or octopus. Follow me @CristinaMittermeier for more stories from the incredible wilderness of Canada's western coast. #Whale #Lunch #FunFacts #Nature"
366,https://scontent-sea1-1.cdninstagram.com/vp/cda749b16aaf5c6a26ba79aa02256519/5E4C73D8/t51.2885-15/fr/e15/s1080x1080/72891028_519947868836210_113539546613604144_n.jpg?_nc_ht=scontent-sea1-1.cdninstagram.com&_nc_cat=102,280893,1303,"Photo by Rena Effendi @renaeffendiphoto | Every Sunday the villages of the Maramureș region in Romania transform, as people put their best clothes on and spill out onto the streets for church service. These small, rural communities have managed to preserve their cultural identity in spite of the fact that many young people choose to migrate to Western Europe in search of urban-based jobs. #followme @renaeffendiphoto for more human interest stories. #romania #culture #dailylife #tradition"
367,https://scontent-sea1-1.cdninstagram.com/vp/1905e4c8c90892bfe9230916f49ccc3c/5E66EFAD/t51.2885-15/fr/e15/p1080x1080/71333476_2357249091256393_7805982207927312814_n.jpg?_nc_ht=scontent-sea1-1.cdninstagram.com&_nc_cat=101,538018,3317,"Photo by Jimmy Chin @jimmychin | Conrad Anker and Brady Robinson peer out of a portaledge after a 4-day storm on K7. The living space was a crammed mashup of knees, shoulders, elbows, boots, wet socks, gloves, etc. It was a sorry, fetid, sagging excuse of a home. A lot of people ask what three guys stuck in a two-person portaledge talk about for four days. Well...not much. Nothing to do but melt snow for water and ponder life’s existential questions. For more images of alpine adventures around the world, follow @jimmychin"
368,https://scontent-sea1-1.cdninstagram.com/vp/dabac3e4d396ceb4015bf9d511d72b44/5E5F3DDD/t51.2885-15/e35/p1080x1080/72655088_983597518659823_10435348701751300_n.jpg?_nc_ht=scontent-sea1-1.cdninstagram.com&_nc_cat=1,494614,2358,"Photo by @KenGeiger | Look in the lower left corner of the first image—for scale, that's downtown Denver, Colorado. This thunderstorm was so massive I had to stitch several frames together to make this panorama. Colorado summer evening thunderstorms are one of the best free entertainments nature has to offer. #getoutside #infrared #blackandwhitephotography #thunderstorm 
To explore more images of the world follow @KenGeiger"
369,https://scontent-sea1-1.cdninstagram.com/vp/224193abfe3b5d18c3a3bd5c82dd1053/5E5EECE2/t51.2885-15/fr/e15/s1080x1080/73043846_126390201718070_2041576176377754794_n.jpg?_nc_ht=scontent-sea1-1.cdninstagram.com&_nc_cat=102,280395,1045,"Photo by Hannah Reyes Morales @hannahreyesmorales | Nat Geo is celebrating women who fearlessly push boundaries and inspire the next generation of changemakers. For the next week, all of our posts and stories on @natgeo will be photographed by women, about women.

Eleven-year-old pro skateboarder Sky Brown skates in Venice Beach, California. ""I want girls to know they can do anything they want,"" she says. She’s got her sights set on the Olympics. If she qualifies, she could match the record for the youngest athlete to compete in the Summer Olympics. 
For more stories, follow me @hannahreyesmorales. #girls

Use #NatGeoWomenofImpact to share how a woman in your life has empowered you."
370,https://scontent-sea1-1.cdninstagram.com/vp/aae4702956e12487eb8dd665257b78ad/5E58E2B1/t51.2885-15/fr/e15/s1080x1080/72694724_447087852605778_8606098139469621717_n.jpg?_nc_ht=scontent-sea1-1.cdninstagram.com&_nc_cat=106,295334,1514,"Photo by Hannah Reyes Morales @hannahreyesmorales | We are kicking off Women’s Week where we will be celebrating all the women who fearlessly push boundaries and inspire the next generation of changemakers. All of our posts and stories on @natgeo will be photographed by women, about women.

Marta, a survivor of assault, sits with her husband, Apolinar, in their home. Marta describes Apolinar’s support as instrumental to her healing.

Marta is part of the Malaya Lolas, a group of grandmothers in the Philippines who were collectively assaulted more than seven decades ago in a mass rape during the Second World War. In the absence of working structures to seek support and reparations, they came together, formed friendships, and rebuilt their town, which was reduced to ashes. ""We aren’t strong enough to protest in the streets anymore,"" one of the grandmothers told me. ""But we want to tell our story."" I worked on this story more than a decade after my own grandmother told me about her trauma from the war. She cannot form sentences anymore, but it felt necessary to try to recall what she wanted to impart. These grandmothers—and my own—showed me that the stories we are told are living histories that we all have a part to play in writing. 
To see more from this project, ""Roots From Ashes,"" follow me @hannahreyesmorales.
#Philippines #JSM2019 #worldpressphoto

Use #NatGeoWomenofImpact to share how a woman in your life has empowered you."
371,https://scontent-sea1-1.cdninstagram.com/vp/59774c00a2e3c5b9e2b7cd377ff33cd2/5E47BE18/t51.2885-15/fr/e15/s1080x1080/68756483_2383922915211760_4075267317233078758_n.jpg?_nc_ht=scontent-sea1-1.cdninstagram.com&_nc_cat=104,250510,865,"Photo by Nichole Sobecki @nicholesobecki | I met Lowelu Krion on the shores of Lake Turkana, as she waited for her father and brothers to return from retrieving their fishing nets. Sitting together, her mother told me of their life beside the jade sea, and the home it had been for her mother and others, generations back. The harsh terrain surrounding the blue-green waters here ensured that this was the last great African lake mapped by Europeans, and it remains one of East Africa’s most remote regions. The world’s largest permanent desert lake, Turkana has existed for some four million years, but Lowelu’s mother was concerned with the future, not the past. A dam up north and nearby plantations are squeezing the lake and those who survive by fishing from its shores. Many worry its days are numbered. Uncertainty looms for Lowelu and her family, but in the determination of her gaze I felt a small but fierce glimpse of hope. #laketurkana #kenya #water #nicholesobecki"
