,post_url,num_likes,num_comments,caption
0,https://scontent-sea1-1.cdninstagram.com/vp/8ecca003eecc1c04bb2d0d1664fb2dbf/5E5855EA/t51.2885-15/fr/e15/p1080x1080/73470573_2379932355465500_5911456957691088762_n.jpg?_nc_ht=scontent-sea1-1.cdninstagram.com&_nc_cat=108,455787,1234,"Photo by Jimmy Chin @jimmychin | Half Dome after a storm. For more images of wilderness landscapes around the world, follow @jimmychin"
1,https://scontent-sea1-1.cdninstagram.com/vp/5167596af2873c038998780848ebdf73/5E89487C/t51.2885-15/e35/s1080x1080/72660983_438148996837205_4568739265499612557_n.jpg?_nc_ht=scontent-sea1-1.cdninstagram.com&_nc_cat=105,246999,941,"Photos by Ian Teh @iantehphotography | I’m on the trail to discover how cardamom is harvested and used in Vietnamese culture. On this day I’m off to a region in Sapa that’s supposed to have some spectacular scenery—if only I could see it. Swipe to see more. 1. Traveling Vietnamese style, Lang has my suitcase between her legs, and I have my camera bag on my front, with camera in hand, plus a backpack. 2. The near-constant fog gave way to torrential rain today, hence the emergency poncho outfits. 3. The rain didn't relent so plan B was to have a Vietnamese coffee. Sure enough, the weather improved after I ordered. 4. The weather cleared a little, giving me a taste of what surrounded me. On assignment for @natgeo #onassignment #natgeo #vietnam #sapa #travel"
2,https://scontent-sea1-1.cdninstagram.com/vp/2134b8427eca72793d85734c33ad6d24/5E43C4D8/t51.2885-15/fr/e15/s1080x1080/70484592_2488119921407632_5252371194531992244_n.jpg?_nc_ht=scontent-sea1-1.cdninstagram.com&_nc_cat=104,610340,3481,"Photo by Thomas Peschak @thomaspeschak | The mystery of the Galápagos shrinking iguana: In lean times, when food is scarce, marine iguanas are able to shrink their skeleton and reduce their size by up to 20%. Smaller animals require less energy, and the odds of surviving tough times increases. When food (mainly seaweed) becomes abundant again, their skeletons can regrow. Follow @thomaspeschak for more close encounters with marine iguanas."
3,https://scontent-sea1-1.cdninstagram.com/vp/78df8a5939b04b6697e6fa86114491e1/5E5ED408/t51.2885-15/fr/e15/s1080x1080/70594994_2448995185319541_2117090738853338928_n.jpg?_nc_ht=scontent-sea1-1.cdninstagram.com&_nc_cat=109,160973,492,"Photo by Katie Orlinsky @katieorlinsky | Olga and Anna Lang at their family’s cabin on the Kolyma River, outside Cherskiy, Siberia. Like a lot of remote communities in the Arctic, the Lang’s cabin is off the grid, far from any grocery stores and with minimal access to power and electricity. They live off the land as much as they can, depending on hunting and fishing for dietary staples. However, as permafrost thaws, their ice cellar (a homemade freezer dug into the permafrost) keeps flooding, and the Langs and others like them struggle to keep their fish and meat fresh. Learn more about permafrost in my recently published @natgeo article “The Threat Below” (link in my bio @katieorlinsky)."
4,https://scontent-sea1-1.cdninstagram.com/vp/0353ce11ba92fa00eebe6162b29b8f3b/5E55E99C/t51.2885-15/fr/e15/s1080x1080/73393206_1737857599679766_2290445194462404188_n.jpg?_nc_ht=scontent-sea1-1.cdninstagram.com&_nc_cat=106,185601,730,"Photo by Tasneem Alsultan @TasneemAlsultan | ""I can't define what type of marriage I had for 18 years, but I know I suffered. I finally understood that in order to receive my divorce, I had to give away my children. On my tearful return from dropping off my children to their father in a new city, I found that my home had been set on fire. I had lost everything. When the pain is too intense, you become numb..."" These are the words of woman I'll call ""N,"" who stands in the shell of her home. She plans to rebuild it. As part of my ongoing project Saudi Tales of Love, I've been documenting the lives of over 40 Saudi women across the country. I realize as a Saudi woman myself that there are obstacles that are unique to us as Saudi women, but I also have come to see how the more difficulties there are...the more strong and resilient we become. #women #saudiarabia

Nat Geo is celebrating women who fearlessly push boundaries and inspire the next generation of changemakers. For a week, all of our posts and stories on @natgeo were photographed by women, about women. Use #NatGeoWomenofImpact to share how a woman in your life has empowered you."
5,https://scontent-sea1-1.cdninstagram.com/vp/148e905bc2757e83d0edefa153be332a/5E5DE27D/t51.2885-15/fr/e15/s1080x1080/70628931_560748411335058_1019327032507952234_n.jpg?_nc_ht=scontent-sea1-1.cdninstagram.com&_nc_cat=106,240420,1034,"Photo by Muhammed Muheisen @mmuheisen | A father and daughter moment: This is Mohammed, a 32-year-old refugee from Afghanistan, playing with three-month-old Dunia outside their shelter in a camp in Athens, Greece. For more photos and videos of the refugee crisis, follow me @mmuheisen @mmuheisenpublic. For more on how to get involved, follow @everydayrefugees.  #muhammedmuheisen #everydayrefugees"
6,https://scontent-sea1-1.cdninstagram.com/vp/fd4fb78dcb1d44684d60e432403357e0/5E5AB209/t51.2885-15/fr/e15/s1080x1080/69568726_704359700012738_1908601801647046734_n.jpg?_nc_ht=scontent-sea1-1.cdninstagram.com&_nc_cat=102,329844,621,"Photo by Pete McBride @pedromcbride | Seeing Stripes: Botswana’s national animal, the zebra, migrates across the country twice a year. During the migrations, zebras and other wildlife started competing with cattle for limited water sources  after the Boteti River dried up. In 2009 high rainfall restored the river’s flow for the first time in 20 years, bringing much-needed relief to the area’s migratory animals. Botswana is one of 17 countries under extremely high water stress, like many regions facing imminent global water shortage. For more on conservation of wildlife and water, follow @pedromcbride. #zebras #Botswana #okavango #water #migration"
7,https://scontent-sea1-1.cdninstagram.com/vp/64c169741dd2818ac3f6fd49a355689e/5E555130/t51.2885-15/fr/e15/s1080x1080/70349855_531297774337339_3992793999803569802_n.jpg?_nc_ht=scontent-sea1-1.cdninstagram.com&_nc_cat=107,259554,1059,"Photo by Stephanie Sinclair @stephsinclairpix | Today is the International Day of the Girl Child, which aims to highlight and address the needs and challenges girls face, while promoting girls' empowerment and the fulfillment of their human rights. For this year’s theme, GirlForce: Unscripted and Unstoppable, I am sharing an image of girls participating in a soccer training provided by the nonprofit organization @yuwaIndia, which works with girls from socially and economically disadvantaged families in rural Jharkhand, where 5 out of 10 girls drop out of school and become child brides. Sports can be used as an empowerment tool, challenging gender norms while building self-esteem, courage, and self-efficacy. When community members see girls achieve in sports, they often recognize their potential to achieve in other domains as well. Over the next week, I will be sharing more images from this Nat Geo assignment on my feed @stephsinclairpix and @tooyoungtowed. #DayoftheGirl #letgirlslearn #endchildmarriage"
8,https://scontent-sea1-1.cdninstagram.com/vp/8e1bf58b61036c52d008bcf1418c0fef/5E540EC4/t51.2885-15/fr/e15/s1080x1080/72359783_450897025528823_958149796342377834_n.jpg?_nc_ht=scontent-sea1-1.cdninstagram.com&_nc_cat=111,267327,538,"Photo by Drew Rush @drewtrush | Sugarloaf Mountain stands near the top of the Snowy Range, in southeastern Wyoming. Fall is sweeping across the Rockies, and soon lakes that seemingly just thawed will freeze again with the onset of winter. To see more from across the West, follow along with photographer @drewtrush."
9,https://scontent-sea1-1.cdninstagram.com/vp/57bb33df30b192a7b9ac9edfb44d7507/5E4A4D12/t51.2885-15/fr/e15/p1080x1080/72625018_476970262890615_8740506596305818953_n.jpg?_nc_ht=scontent-sea1-1.cdninstagram.com&_nc_cat=103,202772,554,"Photo by Michael Christopher Brown @michaelchristopherbrown | The Old City of Jerusalem is not only a holy place and home to several of the world’s religions and their followers, but also a good place to meet visitors from around the world. I love wandering the different quarters and pathways, chatting with various folks and photographing the terrain and diversity of life, all contained within a .9-square- kilometer walled area inside the modern city of Jerusalem. #jerusalem #old city"
10,https://scontent-sea1-1.cdninstagram.com/vp/7856c35c5ada1c3bba14ecb4d96b5816/5E68770B/t51.2885-15/e35/p1080x1080/73505108_2430592750329647_1711246570989833753_n.jpg?_nc_ht=scontent-sea1-1.cdninstagram.com&_nc_cat=111,589061,1476,"Photo by George Steinmetz @geosteinmetz | Harvesting wheat on China’s Loess Plateau, in Ningxia, is still a family affair. The fine silty soil was deposited by desert winds over thousands of years, and then carved into terraces for agriculture. Farming here is increasingly difficult as children migrate to the cities for higher paying jobs. With a small amount of arable land per capita, China struggles to feed itself. To explore more of our world from above, follow @geosteinemtz."
11,https://scontent-sea1-1.cdninstagram.com/vp/f41c7679748793e163941e6bfe5b0fe3/5E56A34A/t51.2885-15/fr/e15/s1080x1080/74349805_427903131456758_4499703217155466339_n.jpg?_nc_ht=scontent-sea1-1.cdninstagram.com&_nc_cat=102,234048,346,"Photo by William Daniels @williamodaniels | Near Sugula, in southern Mali, a group carries basins of maize cobs on their heads. In 2009, I travelled for a week in the region to photograph countryside schools for a project on education. In crowded rooms, I met children excited to attend but also those who can’t because they have to work with their parents. Sometimes I even photographed adults outside a school as they listened to the teacher through a window. Wherever I am in the world, I love visiting schools— they tell us so much about the societies we are visiting. Follow me on @williamodaniels for more human stories around the world."
12,https://scontent-sea1-1.cdninstagram.com/vp/2956130b9b61b58b86cbcc0b00b6793e/5E67ADF0/t51.2885-15/fr/e15/s1080x1080/71292356_473781706562994_1959106644629996_n.jpg?_nc_ht=scontent-sea1-1.cdninstagram.com&_nc_cat=106,321740,1206,"Photo by David Guttenfelder @dguttenfelder | The bright lights of Las Vegas Boulevard shine at night. Today is World Cities Day. How will the cities of the future be powered? What will a renewable energy, carbon-free future look like? How can we get there? This photograph was made on Day 6 of an ongoing @natgeo renewable energy road trip across the USA #roadtripto2070 #WorldCitiesDay"
13,https://scontent-sea1-1.cdninstagram.com/vp/7001b833780d07c86bbe406ecf01bdc6/5E5EC094/t51.2885-15/fr/e15/s1080x1080/75306170_111068363490166_6978694684331901542_n.jpg?_nc_ht=scontent-sea1-1.cdninstagram.com&_nc_cat=110,248511,546,"Photo by Ivan Kashinsky @ivankphoto | A man walks on the Salar de Uyuni, in Bolivia, the world’s largest salt flat. This photo was part of book project in which Karla Gachet and I traveled from the Equator to the southern tip of South America."
14,https://scontent-sea1-1.cdninstagram.com/vp/312adf4704b2cbe28a9b57ee35593678/5E4FAD1D/t51.2885-15/fr/e15/s1080x1080/67378801_138736117393813_4864674879816884476_n.jpg?_nc_ht=scontent-sea1-1.cdninstagram.com&_nc_cat=101,535627,1754,"Photo by Babak Tafreshi @babaktafreshi | Far from city lights, there is unrivaled joy in stargazing and photography under a natural dark sky. The telephoto view reveals the tail of constellation Scorpius and two star clusters in the Milky Way. Appearing in this this single-exposure photograph is my friend Roger Craig Smith, renowned voice actor, and one of the many in the world who spend time under stars as their main hobby. Known as amateur astronomers, they can be of any age, from teenagers to seniors, from any profession, culture, and country. Some join together to form local astronomy clubs and some enjoy the solitude at dark. Some are general hobbyists with a pair of binoculars or a simple camera, and some are dedicated observers discovering new objects in the sky. What is shared by all of them is a respect for the dark skies and the natural night environment that we are losing to light pollution. See ""Our nights are getting brighter, and Earth is paying the price"" on natgeo.com for more and follow me @babaktafreshi for The World at Night photography. #saveournightsky #twanight #stargazing #astrophotography"
15,https://scontent-sea1-1.cdninstagram.com/vp/98c780a72ee4f5e980054c08914000d9/5E55554B/t51.2885-15/fr/e15/s1080x1080/72698472_403375553924983_8214613818354377830_n.jpg?_nc_ht=scontent-sea1-1.cdninstagram.com&_nc_cat=107,488847,1422,"Photo by Jasper Doest @jasperdoest | My cousin Odette takes Flamingo Bob out for a swim or a stroll on the beach almost every week. She loves seeing Bob in his natural environment, but realizes that he would never be able to survive out there. She rescued him almost three years ago after he flew against a hotel window on Curaçao, and during the rehabilitation process she found that he suffered from a chronic foot condition and couldn't go back to the wild. However, the idea that the bird is playing an important role in flamingo conservation in the Caribbean comforts her, and in the meantime they enjoy their weekly time off. Follow @jasperdoest for more images of Flamingo Bob. #flamingo #prettyinpink #flamingobob #curacao"
16,https://scontent-sea1-1.cdninstagram.com/vp/ea1c685d363dded211e37d51bbd7bd1c/5E587519/t51.2885-15/fr/e15/s1080x1080/72847784_2126882097621123_7519182217883505852_n.jpg?_nc_ht=scontent-sea1-1.cdninstagram.com&_nc_cat=103,248896,813,"Photo by Sara Hylton @sarahyltonphoto | A mother and her child at an Afghan refugee settlement, on the outskirts of Islamabad, Pakistan, pause from their daily duties. This image was made in July 2018, in the lead-up to the federal elections. Newly elected Prime Minister Imran Khan promised to grant citizenship to Afghan refugees, but over a year later, citizenship is still off the table. For more stories follow me @sarahyltonphoto #refugees #Afghanistan #Pakistan"
17,https://scontent-sea1-1.cdninstagram.com/vp/01cc2ee4d02a4ec3083390cd20796da8/5E47AF40/t51.2885-15/fr/e15/s1080x1080/74898934_1388230824664698_5012593492047776024_n.jpg?_nc_ht=scontent-sea1-1.cdninstagram.com&_nc_cat=106,187944,554,"Photo by Nichole Sobecki @nicholesobecki | There’s something gorgeous to me about this moment of temporary flight. In this small apartment in Zimbabwe’s first high-density township, Mbare, three generations of women and children gather in the room where they study, laugh, and sleep. The mother and grandmother did laundry to support them all, but through a child's imagination this green washing pail had been transformed. Gone were the suds and dirty clothes—this was an airplane going to a destination unknown. #highflyer #mbare #zimbabwe #women"
18,https://scontent-sea1-1.cdninstagram.com/vp/9cb93dab694497107df898fe8366ca1b/5E4B3C7B/t51.2885-15/fr/e15/s1080x1080/74470867_556642878238268_8458314061162238733_n.jpg?_nc_ht=scontent-sea1-1.cdninstagram.com&_nc_cat=1,188451,768,"Photo by Karla Gachet @kchete77 | Yessenia Aguayo prepares for her quinceañera (15th birthday) at her grandparents house in the province of Los Rios, Ecuador, in 2008. For this celebration, her entire extended family pitched in and the whole town was invited. Yessy grew up in Hacienda La Mariana, a tightly knit community that survives off their land. Most of the people are blood related and inherited land from their parents. A quinceañera is a special celebration, a coming-of-age ritual. Back in the day, it used to be a way to show off your daughter to possible suitors. Things are starting to change for girls in the community. Yessy finished school and went on to college, and in this way she became a role model for many of her younger cousins. #mocache #montubiopride"
19,https://scontent-sea1-1.cdninstagram.com/vp/6f546add1fce2e8a27fafad335d251e8/5E57F8E7/t51.2885-15/e35/s1080x1080/70506189_138362024196622_8316699742293096084_n.jpg?_nc_ht=scontent-sea1-1.cdninstagram.com&_nc_cat=110,206644,662,"Photo by @jimrichardsonng // Sponsored by @IndigoAg // Piloting her 16-row combine with GPS-guided precision, farmer Annie Dee brought in her 2019 corn harvest when I visited her Alabama farm last month. Mankind’s autumn harvest rituals have become huge technological spectacles as we struggle to feed our burgeoning world population. Just as important—but harder to see—is what Annie is doing with her soil: She’s using no-till agriculture. By reducing tillage (not plowing and leaving crop residue in place), she can actually help in capturing carbon from the atmosphere and sequestering it in the soil. For a long time, world agriculture has been depleting soil carbon and releasing it into the atmosphere. Reversing that trend, especially on large-scale farms like Annie’s, could be a big win all around. // @IndigoAg is unlocking agriculture’s potential to help reverse climate change. That’s the vision behind the Terraton Initiative, a global movement with the goal of using regenerative farming practices to take one trillion tons of carbon dioxide from the atmosphere. Follow @Terraton to see the progress."
20,https://scontent-sea1-1.cdninstagram.com/vp/1b22302ea63d38c235878a20fbf4f409/5E65AE9C/t51.2885-15/fr/e15/s1080x1080/70520099_2357637627885812_7799197382049576325_n.jpg?_nc_ht=scontent-sea1-1.cdninstagram.com&_nc_cat=108,359285,1073,"Photo by @franslanting | “Baobab trees are my all-time favourite. There’s something so unique and special about them—which is why I’ve been a bit cheeky and included them twice in my takeover today! This giant of the African forest is the tree of life, supporting everything from the largest mammals to the tiniest creatures. I especially love #LookingUp and seeing them in Botswana, where Frans Lanting has taken this beautiful picture.” –Prince Harry, The Duke of Sussex @sussexroyal

Frans’s photograph was taken on Kubu Island in Makgadikgadi Pans, Botswana.

Please keep sharing your own #LookingUp images from your own community, and at the end of the day The Duke will be sharing some of his favourites on @sussexroyal Instagram stories.
...
Today, The Duke of Sussex @sussexroyal is guest-editing the @natgeo feed, in an effort to raise awareness around Queens Commonwealth Canopy, in which almost 50 countries have dedicated indigenous forest for conservation or have committed to planting millions of new trees to combat climate change. 
The images being posted today are all ‘looking up’ at trees from below to highlight the vital role trees play in the Earth’s ecosystem. Post your images of trees, add #lookingup, and at the end of the day, The Duke will share a selection of images that you post from across the world on @sussexroyal Instagram stories"
21,https://scontent-sea1-1.cdninstagram.com/vp/1667c613d7b50ef8e604342876bbe355/5E5D2D25/t51.2885-15/fr/e15/s1080x1080/72533660_151944839350114_2960490947012932657_n.jpg?_nc_ht=scontent-sea1-1.cdninstagram.com&_nc_cat=110,165743,395,"Photo by Cory Richards @coryrichards | Every autumn Hindu families across Nepal worship the fearsome goddess Durga during the Dashain festival. Durga demands a blood sacrifice, and on the main festival day an uncountable number of goats are exchanged for prosperity, safety, and a good meal.

Buddhists celebrate their own festival on this same day, lighting butter lamps and saying prayers so that the animals may have safe passage through the afterlife and a more fortuitous rebirth.

We are #onassignment in the Mustang region, looking at how traditional practices are adapting to modern-day pressures. Roads, Buddhism, monarchies, climate change, and goat herding are all connected. Text by Ben Ayers @jetbutterflies.

#followme @coryrichards @jetbutterflies and our expedition team Kyle Daly, Above The Clouds, and Abiral Rai for more real-time images from #nepal"
22,https://scontent-sea1-1.cdninstagram.com/vp/7e146c4ffe70a68895432a83f6a54438/5E493ADD/t51.2885-15/fr/e15/p1080x1080/73475370_1125440290990641_1909970589940625165_n.jpg?_nc_ht=scontent-sea1-1.cdninstagram.com&_nc_cat=109,514453,1199,"Photo by Drew Rush @drewtrush | While we were in Yellowstone National Park this summer, we had a chance to look for wildlife every day. Catching the sunrise as you watch a group of bull elk feed is something you'll never forget—no matter how many times you may be fortunate enough to see it. Shot while on a student trip with @natgeoexpedtions. To see more wildlife images, follow along with photographer @drewtrush."
23,https://scontent-sea1-1.cdninstagram.com/vp/62622573db610bbb27ba451ed32fd4c9/5E5ED433/t51.2885-15/e35/p1080x1080/70241560_177335836780232_1637244966778085644_n.jpg?_nc_ht=scontent-sea1-1.cdninstagram.com&_nc_cat=108,1320206,6693,"Photo by George Steinmetz @geosteinmetz | The ""prow"" of Mt. Roraima, one of the most spectacular tepuis in Canaima National Park, straddles the border of Venezuela, Guyana, and Brazil. Over 7,000 feet tall, it's a remnant of the supercontinent Gondwana, and was fictionalized in the movie ""Up."" The heavily eroded limestone plateau is home to endemic varieties of carnivorous plants and animals. With thanks to Francisco Salas Roche for the offer to fly me around his native land.  To explore more of our world from above, follow @geosteinmetz. #UNESCOWorldHeritage #tepuis"
24,https://scontent-sea1-1.cdninstagram.com/vp/5b17ef6b15bb4b801fc6b28440947ed3/5E55DFEF/t51.2885-15/fr/e15/s1080x1080/67878742_162022074951216_1814196080996048913_n.jpg?_nc_ht=scontent-sea1-1.cdninstagram.com&_nc_cat=100,532371,1589,"Photo by Dina Litovsky @dina_litovsky | Three people walk toward the Temple of Transition at the Burning Man festival in Black Rock City, Nevada. The annual event attended by over 70,000 people and known for its psychedelic dance parties and elaborate art installations, features a different, larger-than-life temple each year. On the last day of Burning Man, the temple is burned to the ground in solemn silence. I've attended the festival over the years, and this magnificent structure from 2011 remains my favorite. For more images, follow me @dina_litovsky"
25,https://scontent-sea1-1.cdninstagram.com/vp/c351651a22e1ecec88d5c33605d6de09/5E531BCF/t51.2885-15/fr/e15/s1080x1080/69693751_186027439092134_7958439102289727938_n.jpg?_nc_ht=scontent-sea1-1.cdninstagram.com&_nc_cat=102,710582,2124,Photo by Thomas Peschak @thomaspeschak | Watching an epic Aldabra sunset in the company of reef sharks is an intensely magical experience. This is a truly timeless land and seascape at the western edge of the Indian Ocean. Remote islands make me happy and fuel my creativity like nothing else. For more photographs from some of the wildest islands on our planet follow @thomaspeschak
26,https://scontent-sea1-1.cdninstagram.com/vp/a198887fa68d126982ca92eb55a4e154/5E5F0A0D/t51.2885-15/fr/e15/p1080x1080/69568571_495441347924652_321760199879159951_n.jpg?_nc_ht=scontent-sea1-1.cdninstagram.com&_nc_cat=100,275209,627,"Photo by Michael Christopher Brown @michaelchristopherbrown | Palestinian farmers use a threshing machine to remove wheat seeds from stalks near As-Sawiya, a West Bank village. Almost entirely dependent on agriculture, the primary crops grown around this village are wheat, olives, grapes, figs, and beans. The area has been inhabited for well over 1,000 years, as potsherds from the 8th and 7th century B.C.E. have been found here. For more, follow @michaelchristopherbrown."
27,https://scontent-sea1-1.cdninstagram.com/vp/6fb7b3df9a276a1451f5a75e9f952d08/5E4D4DF6/t51.2885-15/fr/e15/s1080x1080/72967606_179272379792491_4550613646076775057_n.jpg?_nc_ht=scontent-sea1-1.cdninstagram.com&_nc_cat=107,508469,2950,"Photo by Ami Vitale @amivitale | Mary Lengees, one of the first female elephant keepers at Reteti Elephant Sanctuary in northern Kenya, caresses Suyian, the first resident. The dedicated keepers here provide round-the-clock care to the most vulnerable elephants to ensure the best outcomes, staying with them throughout the night. Mary is a trailblazer and an inspiration to me and to all who know her. She is one of the very first indigenous Samburu keepers in all of Africa. Although the idea of women working outside of the home is new here, the community has embraced the program. When the seven women keepers return to their homes, the people in their villages rush to them to hear news about the elephants in their care. 
Follow @amivitale and @r.e.s.c.u.e to get involved and support this crucial work.
@conservationorg @thephotosociety @natgeoimagecollection #protectelephants #elephants #stoppoaching #kenya #worthmorealive

Nat Geo is celebrating women who fearlessly push boundaries and inspire the next generation of changemakers. For a week, all of our posts and stories on @natgeo were photographed by women, about women. Use #NatGeoWomenofImpact to share how a woman in your life has empowered you."
